제목,저자_상세,초록,키워드_상세,저자,저널명,발행기관,권,호,시작페이지,종료페이지,발행년도,주제분야,인용횟수,논문ID
OTT 멀티호밍 이용자의 구독 중단의도 연구: 구독피로감의 매개효과를 중심으로,이상우; 정동아,"디지털 콘텐츠의 소비 증가와 함께 OTT(Over-the-Top) 서비스에 대한 멀티호밍 현상이 점점 보편화되고 있다. 본 연구는 멀티호밍 이용자들이 다수의 OTT 플랫폼을 동시에 구독하면서 겪는 효용과 비용을 분석하고, 이러한 요소들이 구독 취소 결정에 어떻게 영향을 미치는지 탐색하였다. 연구 결과, 경제적 비용과 탐색 비용은 멀티호밍 중단의도를 증가시키는 주요 요인으로 나타났으며, 콘텐츠의 다양성과 큐레이션은 이용자의 멀티호밍 중단의도를 약화시키는 요인으로 작용하였다. 본 연구는 Sweller의 인지부하 이론(Cognitive Load Theory, CLT)을 기반으로, 멀티호밍 이용자들이 겪는 구독피로감과 중단의도 간의 매개효과를 분석하였다. 연구 결과, 경제적 및 탐색 비용이 구독피로감을 유발하는 주된 요인임을 확인할 수 있었다. 멀티호밍 이용자들이 높은 구독료 부담을 느끼고 다양한 플랫폼을 오가면서 느끼는 탐색 비용에 부담을 느낄수록, 구독피로감이 높아져 멀티호밍을 중단할 수 있음을 의미한다. 이 연구는 멀티호밍의 부정적 요인들은 낮추고 효용 요인을 강화시킴으로써, 멀티호밍으로 인한 구독피로감을 줄이고, 이용자 이탈을 방지할 수 있는 방안을 제시했다는 점에서 의의가 있다.",멀티호밍; OTT 이용자; 구독피로감; 이용중단의도,정동아,한국혁신학회지,한국혁신학회,19,3,217,240,2024,과학기술정책학,0,ART003110286
국내 공공도서관 프로그램의 내용분석에 관한 연구 - 정독도서관을 중심으로 -,김나은; 김수빈; 이수상,"공공도서관의 프로그램은 문화적 기능을 수행하며 지역사회 소통의 장이 될 수 있도록 돕는 도구이다. 최근에는 다양한 기관의 프로그램을 통합적으로 안내하는 웹사이트가 증가하는 추세이지만, 프로그램을 기술하기 위하여 정해진 기술 체계가 없는 상황이다. 이에 프로그램의 정보에 대한 체계적인 정보 기술 방안을 마련하기 위해 정독도서관의 프로그램들을 사례로 내용분석을 진행하였다. 내용분석 도구인 MAXQDA를 사용하여 유형, 주제, 특별구분, 이용대상의 항목들에 대한 범주코드들을 도출하였다. 이를 토대로 정독도서관 프로그램의 특성을 분석한 결과는 다음과 같다. 유형에서는 강습, 강의와 같은 프로그램이 많으나, 견학, 공연/상영, 운영체험 관련 프로그램은 적게 나타났다. 주제는 독서, 예술에 해당되는 프로그램이 주류를 이루고 있었으나, 북큐레이션, 시상, 환경 관련 프로그램들은 적게 나타났다. 이용대상의 경우, 성인을 대상으로 한 프로그램이 가장 많았으며, 고등학생, 중학생, 도서관 관계자를 위한 프로그램은 적게 나타났다. 본 연구에서 도출된 정독도서관의 프로그램 범주코드들을 참조하여 개별 공공도서관에서 현재 운영되는 프로그램들을 분류하는 것뿐만 아니라 국내 공공도서관 프로그램에 대한 서비스 플랫폼을 개발하는데 활용이 가능할 것이다.",공공도서관; 프로그램; 내용분석; 정독도서관; 프로그램 서비스 플랫폼,이수상,한국도서관·정보학회지,한국도서관·정보학회,55,2,29,53,2024,문헌정보학,1,ART003092850
가상전시 사용성 평가 및 개선을 위한 휴리스틱 평가 : 웹 기반 메타버스 플랫폼 사례를 중심으로,남고은,"본 연구는 메타버스 플랫폼 내에서 진행되는 가상 전시의 사용성 및 콘텐츠 개선을 목표로, 휴리스틱 분석 도구의 활용을 통해 연구를 진행하였다. 첫 번째 단계에서는, Nielsen의 전통적인 웹 사용성 휴리스틱스와 메타버스의 핵심 구성 요소인 VR, AR, XR, 그리고 소셜 미디어의 특성을 포괄할 수 있는 새로운 휴리스틱스를 구성하기 위해 전문가 집단 FGI를 실시 하였다. 두 번째 단계에서는 로블록스, 제페토, 구글 아트앤컬처, 스페이셜, 디센트라랜드 등 대표적인 메타버스 플랫폼들 에서 운영 중인 전시를 선정, 재구성된 메타버스 휴리스틱스를 적용하여 휴리스틱 평가를 시행하고 사용성과 전시 콘텐츠 측면에서의 주요 문제점들을 분석하였다. 마지막으로 본 연구의 궁극적인 목표는 미래 메타버스 시대의 전시 콘텐츠가 추 구해야 할 핵심 인터페이스 요소들과 콘텐츠 방향성에 대한 지침을 제공하는 데 있다. 따라서 휴리스틱 가이드 평가를 통 해 도출된 결과에서 가장 낮은 사용성 범주로 지적된 ‘도움을 통한 오류 개선’ 및 ‘방향성 및 시점 설정’은 사용자 경험 디 자인 측면에서 개선이 시급해보이며, 질적 평가 과정에서는 전시의 특성을 강조하는 콘텐츠 큐레이션과 디지털 스토리텔링 을 통해 공간을 새로운 방식으로 탐험할 필요성이 강조되었다. 이를 통해 전시의 주제와 목적을 더욱 명확히 전달할 수 있 는 방향으로 가상체험전시 운영이 이루어져야 함을 시사한다.",가상현실 휴리스틱스; 가상 전시; 메타버스; 휴리스틱 평가; UI 사용성 가이드,남고은,상품문화디자인학연구,한국상품문화디자인학회,,76,303,317,2024,디자인일반,2,ART003069858
고등학생들의 추천도서목록 이용과 인식에 관한 연구,정진수,"본 연구의 목적은 고등학생들의 추천도서목록 이용과 인식을 분석하는 것이다. 서울 시내 7개 고등학교 학생들을 대상으로 온라인 설문지를 배포하였고 311명의 학생들의 유효한 응답을 분석하였다. 빈도분석, 이항로짓모형분석, 일원분산분석을 이용하여 데이터를 분석한 주요 결과는 다음과 같다. 첫째, 추천도서목록 이용에 영향을 미치는 요인은 성별, 학년, 추천도서목록의 개별 적합성과 재미에 대한 인식으로 나타났고, 특히 추천도서목록의 개별 적합성에 대한 인식이 긍정적일수록 추천도서목록을 이용한다는 결과가 도출되었다. 둘째, 남학생들이 여학생들보다 추천도서목록 이용을 덜할 것이라는 결과를 나타냈고 사서교사, 교과교사, 독서교육단체 및 기관이 각각 제작한 목록, 입시에 활용된 목록의 이용 의향이 여학생들에 비해 모두 낮았다. 셋째, 독서를 잘 하지 않거나 즐기지 않는 학생들이 사서교사와 교과교사 제작 추천도서목록을 통해 도움을 받을 수 있다는 사서교사들의 인식과는 다르게, 독서를 즐기거나 독서에 어려움을 느끼지 않고 잘하는 학생들이 사서교사와 교과교사 제작 추천도서목록에 대해 오히려 긍정적인 이용 의향을 보였다. 넷째, 모든 유형의 추천도서목록 가운데 학생들은 입시에 활용된 추천도서목록에 가장 긍정적인 이용 의향을 보였다. 본 연구의 결과가 학생들이 추천도서목록을 포함한 다양한 도서정보를 활용할 수 있도록 독서교육의 비계(scaffold)를 고민하는데 기초 자료로서 활용될 수 있기를 기대한다.",고등학생; 추천도서목록; 권장도서목록; 북큐레이션; 추천도서; 권장도서; 학교도서관; 독서교육,정진수,한국문헌정보학회지,한국문헌정보학회,56,3,5,26,2022,문헌정보학,0,ART002868303
OTT 서비스의 콘텐츠 유형별 정보인지 디자인 연구,원종욱,"언제 어디서나 이용할 수 있는 모바일 디바이스와 5G 네트워크의 발전은 실시간 스트리밍이라는 OTT 서비스의 강점을 더욱 부각시키고 있다. 빠르게 성장하는 OTT시장의 패러다임에 맞춰 지속적으로 OTT 서비스의 사용성을 높이고 이용자들이 편리하게 서비스를 이용할 수 있는 효과적인 UI 디자인 개발이 필요한 시점이다. 본 연구는 이론적 고찰을 통해 OTT 서비스의 개념과 콘텐츠 유형(VOD 콘텐츠, 방송사 콘텐츠, 사용자 생산 콘텐츠)을 분류하고 정보인지 디자인의 요인을 가시성, 조형성, 주목성, 정확성의 4가지 요인으로 도출하여 연구에 적용하고자 하였다. 연구 모형을 바탕으로 OTT 서비스를 사용 중인 20-30대 남녀 57명에게 각 OTT 서비스 유형별 정보디자인 요인의 중요도에 대한 설문을 진행하였다. 분석결과 각 유형이 지닌 콘텐츠적 특성에 따라 UI디자인 설계에서 콘텐츠의 배열 및 시각정보의 인지 등의 정보인지 디자인 요소의 중요도가 유형마다 다르게 나타났으며, 우선적으로 고려해야 할 디자인 요인의 순서에 따라 설계되어야 함을 재차 확인할 수 있었다. 본 연구는 최근 빠르게 확산 중인 OTT 서비스의 현황을 살펴보고 UI 디자인의 중요성을 모색하였다는 데 연구적 의의가 있으며, 향후 OTT 서비스 디자인 개발의 기초적 연구로 활용되기를 희망한다.",OTT 서비스; 콘텐츠 큐레이션; 정보인지 디자인,원종욱,커뮤니케이션디자인학연구,(사)한국커뮤니케이션디자인협회 커뮤니케이션디자인학회,75,,143,152,2021,정보디자인,8,ART002711748
"수용자에서 생비자로, 청소년소설의 재매개 양상 연구 -북트레일러를 중심으로-",김지혜,"이 연구는 청소년소설 북트레일러의 생산과 소비에 청소년 독자들이 어떻게 참여하고 있는가를 살펴봄으로써 청소년 독자의 문학 향유 주체로서의 가능성을 살피는 것을 목적으로 하였다. 청소년소설의 북트레일러는 디지털 시대의 재매개적 특성을 잘 보여주는 것으로, 생산 주체에 따라 크게 두 가지로 분류되는데, 첫 번째가 책을 홍보할 목적으로 출판사, 책큐레이션 채널에서 제작한 것이라면, 두 번째가 청소년들이 공모전 참여, 독후 활동 등을 위해 제작한 것이다. 분석 결과, 첫 번째 유형의 북트레일러에서는 청소년 독자들의 댓글을 통해 자발적, 비자발적으로 해당 도서를 읽은 청소년들이 적극적인 문학 향유자로 변모하고 있음을 알 수 있었으며, 이들이 북트레일러의 멀티모드성, 참여적 특성에 큰 관심을 보이고, 독서 동기를 얻고 있다는 점 역시 확인할 수 있었다. 그리고 두 번째 유형의 북트레일러들을 통해서는 청소년들이 생산 주체가 되어 자신이 읽은 청소년소설을 참신하게 표현하고 있음을 살펴 보았다. 이들은 내용적, 외형적 측면에서 기존의 출판사가 제작한 북트레일러보다 다양한 이미지와 효과, 음악 등을 사용함으로써 개성이 강한 새로운 작품을 만들어 내고 있었다. 이 연구를 통해 청소년들이 역동적인 문학 문화의 장 안에서 상호적으로 영향을 주고받는 향유 주체이자 창작 주체로 성장할 수 있음을 확인할 수 있었으며, 북트레일러의 문학 교육적 가능성을 타진해 볼 수 있었다.",북트레일러; 청소년소설; 재매개; 청소년 주체; 생비자; 청소년 독자,김지혜,한국교육논총,교육개발연구소,45,1,73,101,2024,교육학,0,ART003076393
저작권법상 링크와 링크사이트의 법적 성격에 관한 검토,임원선,"링크사이트가 웹하드에 이어 불법 콘텐츠 유통의 주요 채널이 되면서, 세계 각국에서 이의 규제에 관한 논의가 확대되고 있다.
유럽사법재판소는 Svensson 판결에서 링크로 인하여 저작권자가 최초 전송을 허락할 때에 고려되지 않은 ‘새로운 공중’에게 접근이 가능하게 된 경우에는 그것이 저작권자로부터 허락을 받아야 하는 공중전달(이는 우리 저작권법상 전송에 해당한다)이 된다고 판시했다. 이 판결은 공중의 링크 대상 정보에의 접근 가능성을 기준으로 링크를 분류할 필요가 있음을 시사한다. 이에 본고에서는 링크를 공중의 접근이 금지된 정보에의 링크, 공중의 접근이 제한된 정보에의 링크, 그리고 공중의 접근이 개방된 정보에의 링크 세 가지로 분류할 것을 제안하였다. 이 중에서 공중의 접근이 금지된 정보에의 링크를 통해 정보가 공중이 접근가능하게 되었다면 그것은 그 정보를 처음으로 공중 또는 새로운 공중의 이용에 제공하는 것이므로, 그 자체가 전송에 해당하고, 일본 저작권법상 제5의 송신가능화 행위에 해당할 수 있다.
유럽사법재판소는 사용료의 지불을 통한 회원가입 등 이용자가 선택가능한 접근 제한을 우회하는 링크를 통해서도 ‘새로운 공중’ 기준이 충족된다고 보았으나, 새로운 공중 기준은 공간이나 시간 등에 관한 제한처럼 이용자가 선택할 수 없는, 시장을 분할할 수 있는 제한을 우회하는 것에 의해서만 충족될 수 있다. 잠재적 이용자는 새로운 공중이 될 수 없다.
정보에의 접근을 지원하는 서비스를, 야후로 대표되는 디렉터리 서비스와 구글로 대표되는 검색 서비스에 이은 큐레이션 서비스의 세 가지 서비스로 제시하고, 링크와 달리 링크사이트가 저작권 산업에 파괴적 위력을 발휘하고 있는 이유를 그것이 이 제3의 서비스인 큐레이션 서비스의 형태를 취하고 있음에서 찾았다. 링크사이트 운영의 특징을 실제로 분석하면서, 그것이 저작권법이 정하고 있는 네 가지 면책 요건에 부합하지 않는 것을 확인하였다. 큐레이션 서비스는 운영자의 주의 깊은 지속적인 관리를 필요로 하기 때문에 속성상 이들 요건을 충족할 수 없기 때문이다.
As the link-sites has become the main channel of trafficking illegal content following cyber-lockers, there has been hot debate on how to regulate them. Court of Justice of the European Union ruled in 2015 that where a link makes it possible for users which were not taken into account by the copyright holders when they authorized the initial communication of the protected work, the users must be deemed to be a ‘new public’ and accordingly the holder’s authorization is required for such a communication to the public. This reasoning asks a new classification of links on the basis of the possibility of public access to the targeted works. Accordingly I propose to classify links into three types, i.e. links to the works to which the public is prohibited to access, links to the works to which the public is restricted to access, and links to the works to which the public is free to access. Where a link makes it possible for public to access to a work to which the public is prohibited to access, it means that the link makes the works available to the public for the first time. In this case, the linking could be 5th type of making transmittable in Japanese Copyright Act. CJEU ruled that ‘new public’ criterion could be fulfilled with the link that circumvent restriction which could be disposed by the users, such as subscription or paywall. The potential users who cannot access to the protected works due to the disposable restriction should be considered the public which was taken into account at the time of the initial communication to the public. Accordingly the restriction related to the new public should be restricted to the one which could not be disposed by the users, so could devide markets for the works, such as space restrictions, e.g. accessible for the specific country IP only, and time restrictions. The potential users cannot be the new public. The services which assist users to access to the information on the Internet can be classified into three types, i.e. directory service represented by ‘Yahoo’, search service represented by ‘Naver’ and ‘Google’, and curation service. The reason that rink-sites have such a destructive influence on the content industry differently from mere linking could be explained by the fact that link-sites provide curation service which complements the shortcomings which search service and directory service has. Accordingly link-sites as a curation service could hardly satisfy the four conditions enumerated in the Copyright Act for a safe harbour, because curation service means careful and continuous management by the operators.",링크; 링크사이트; 새로운 공중; 전송권; 큐레이션,임원선,계간 저작권,한국저작권위원회,30,3,133,159,2017,법학,9,ART002266361
기독교대학 ‘인성교육’을 위한 도서관 역할에 관한 사서 인식 연구,orcid 바로가기; 구정화; 이성숙,"본 연구는 기독교 진리에 기초한 인재들을 길러내는 것을 목표로 하는 기독교대학에서 기독교 인성교육을 수행함에 있어 이를 지원하는 대표 부속기관 중의 하나인 도서관은 어떤 역할을 수행하는 것이 바람직한가에 대한 전문 사서들의 인식과 요구를 조사하였다. 이는 기독교 대학 사서들의 인성교육 및 지원에 대한 인식과 요구사항을 토대로 기독교대학의 인성교육 지원을 위한 사서 재교육 내용과 방법을 구상하기 위한 기초자료로 활용하기 위함이다.
본 연구목적을 달성하기 위해 기독교대학 도서관에 근무하는 사서들을 대상으로, ‘설문조사법’과 ‘면담법’을 이용하여 연구 데이터를 수집하였다. ‘기독교대학에서 수행해야 할 인성교육의 영역에 대한 사서 인식’, ‘신앙과 직업과의 관계(세계관 및 직업관)’, ‘인성교육 지원을 위해 기독교대학 도서관이 수행해야 할 핵심 역할에 대한 인식’, ‘도서관이 인성교육을 지원함에 있어 걸림돌과 이를 극복하기 위한 요구(재교육 내용)’라는 주제를 중심으로 설문조사하고, 응답에 대한 이유와 기저 배경에 대한 내용은 심층면담법을 통해 관련 데이터를 수집하고 분석하였다.
연구결과, 인성교육 지원에 있어 도서관은 인성교육 전담 부서와 협력하되 동등한 위치에서 관련 프로그램을 함께 기획하고 실행하는 것이 바람직하다고 인식하고 있었다. 구체적인 방법으로는 인성교육과 관련된 특수 주제장서 수집과 큐레이션을 꼽았고, 그 장서를 활용한 교육서비스인 독서교육 프로그램과 정보의 윤리적 사용에 대한 교육서비스와 교육장소를 지원하는 것이 도서관의 주요서비스이자 역할이라 인식했다. 도서관의 인성교육지원에 있어 가장 큰 제한점으로 외적으로는 전문사서의 부족과 제한된 예산을, 내적으로는 사서 자신들의 인성교육 의미와 이를 지원해야 된다는 필요성에 대한 몰이해를 한계로 꼽았다. 이를 극복하기 위한 사서 재교육 과정에서 인성교육의 의미와 필요성에 대한 이해와 더불어 성공적이고 구체적인 역할과 서비스 사례들을 소개받고 실행방법들을 전수받길 희망했다.
연구결과 분석을 바탕으로 시사점을 도출하고, 기독교대학 인성교육과정을 지원하기 위해 고려해야 할 사항들과 도서관 역할에 대한 재고, 사서 재교육 과정의 내용과 지원 방향들이 제언되었다. 나아가 본 연구의 한계와 이를 보충할 후속연구 주제들과 연구과제들이 제안되었다.",기독교 인성교육; 사서 인식; 도서관 역할; 기독교대학; 기독교대학 도서관; 사서 재교육,이성숙,신앙과 학문,기독교학문연구회,29,1,5,43,2024,학제간연구,0,ART003066753
디지털 독서 시대 한국학 고전DB 서비스의 발전 방향,최희수,"본 연구는 한국학 관련 고전DB 서비스의 현황을 점검해 보고, 디지털 독서 시대에 걸맞는 서비스 방안을 모색해 본 것이다. 현재 한국학 고전 DB는 여러 기관들에 의해 수행되고 있다. 가장 보편적인 자료 접근방식은 두 가지이다. 하나는 디렉토리 서비스이고, 다른 하나는 검색 서비스이다. 디렉토리 서비스는 각 기관별로 소장자료의 특성에 따라 다양한 분류기준으로 서비스되고 있기 때문에 이용자들에게 혼란을 줄 수 있다. 검색 서비스는 검색 기능을 좋으나, 검색결과를 단순한 목록 형태로 제공하기 때문에 이용자가 원하는 정보에 접근하기 어렵다.
이러한 문제의 개선을 위해서 첫째, 디렉토리 서비스의 개선 또는 신설을 제안하였다. 전문가가 아닌 일반인들이 쉽게 이해할 수 있는 주제, 형태, 저자, 사상 등의 분류기준을 적용하는 것이 바람직하다고 보았다. 둘째, 검색결과 제공 방식의 개선을 제안하였다. 단순한 검색결과 목록 제공방식이 아니라 검색결과 목록 간의 유의미한 관계망을 설정하여 해당 의미별로 검색결과를 묶어서 제공하는 방안을 제시하였다.
한편 고전 읽기에 대한 활성화를 도모하기 위하여 디지털 큐레이션을 도입할 것을 제안하였다. 고전들에 있는 개별 자료들을 의미 관계에 따라 자료를 연결하여 종합적으로 정보를 이해함으로써 하나의 지식체계망을 구성할 수 있도록 제시하였다. 빅데이터나 인공지능과 같은 디지털 기술을 고전정보의 번역과 연구에 도입하는 것과 아울러 서비스에도 이 같은 방식을 통해 전문가가 아닌 일반인들도 고전DB를 원활하게 이용할 수 있는 방안을 살펴보았다.",한국학고전DB; 디렉토리서비스; 검색서비스; 분류기준; 링크드데이터; 디지털큐레이션,최희수,민족문화,한국고전번역원,59,,59,92,2021,기타인문학,3,ART002780358
학교로 찾아가는 오케스트라 교육공연의 개발 사례연구 : '움직이는 악기박물관' 프로그램을 중심으로,정원순,"이 연구는 큐레이션을 접목한 오케스트라 교육공연으로서 문화예술교육의 콘텐츠 개발, 실행, 관찰, 평가를 탐색하는데 의의를 둠으로써, 학교라는 특성에 적합한 방문형 문화예술교육 공연이 지향해야 할 점을모색하는데 목적을 두고 있다.
2019년 4월부터 11월까지 서울지역 초등학교 및 특수학교를 대상으로 30인의 오케스트라단이 직접 학교를 방문하여, 클래식 악기로 연주하였다. 수혜 학교는 초등학교 6개교, 특수학교 2개교로 총 2,095명의 학생이 관림을 하였다.
실행절차는 계획-실행-관찰-평가의 순으로 진행되었으며, 프로그램 구성 및 콘텐츠 개발, 참여자 구성, 프로그램 연주 편곡의 계획 단계를 거친 후, 학교 모집 및 선정, 일정 조율 및 실사, 상반기(4개교), 하반기 (4개교)로 실행을 완료하였다. 실행 과정에서 교육공연으로서의 현장반응, 콘텐츠 구성의 적절성, 공연실행에서의 수정사항 등을 파악하였으며, 이를 바탕으로 편곡위원, 자문위원, 운영진 및 연주자들의 인터뷰를 거쳐 성과 공유회를 통하여 움직이는 악기박물관의 평가를 진행하였다.
그 결과는 첫째, 해설을 통한 클래식 음악의 이해 제고, 둘째, 학교로 찾아오는 관람형 공연의 교육효과, 셋째, 클래식 음악의 다양성 확보, 넷째, 예비 문화예술교육자의 현장 경험 제공으로 확인되었다. 이상의 결과를 토대로, 학교로 찾아가는 방문형 문화예술교육은 학교 현장 및 대상에 적합한 콘텐츠의 다양화와 관람형 문화예술교육의 교육적 가치를 제고할 수 있는 프로그램 개발의 지속성이 필요함을 제언할 수 있다",교육공연; 큐레이션; 음악교육; 문화예술교육,정원순,문화예술융합연구,글로벌문화예술교육연구소,1,1,39,52,2020,문화예술경영,1,ART002895904
