제목,저자_상세,초록,키워드_상세,저자,저널명,발행기관,권,호,시작페이지,종료페이지,발행년도,주제분야,인용횟수,논문ID
학교도서관 북 큐레이션 서비스를 위한 도서추천 기준에 관한 연구,박양하,"본 연구는 학교도서관 홈페이지를 통해 제공할 수 있는 정보 서비스로 북 큐레이션을 제안하고 구체적인 시스템 기획에 앞서 큐레이션의 기준이 되는 추천 기준을 도출하고자 하였다. 이를 위해 첫째, 기존 시스템의 추천도서목록을 분석하여 이용자 정보와 도서 정보에서 추천에 활용할 수 있는 속성을 분석하였다. 둘째, 분석된 속성을 활용하여 12개의 추천 기준을 도출하였다. 마지막으로 설문을 통해 각 기준에 대한 이용자의 선호도를 조사하였다. 설문의 결과는 다음과 같다. 첫째, 대부분의 학생들이 북 큐레이션 서비스가 도서관 이용에 필요하다고 응답하였다. 둘째, 상위 3개 선호 기준은 ‘관심 키워드 중심 추천’, ‘학년단위 다대출’, ‘교과연계도서목록 다대출’이다.",본연구는학교도서관홈페이지를통해제공할수있는정보서비스로북큐레이션을제안하고구체적인시스템기획에앞서큐레이션의기준이되는추천기준을도출하고자하였다.이를위해첫째;기존시스템의추천도서목록을분석하여이용자정보와도서정보에서추천에활용할수있는속성을분석하였다.둘째;분석된속성을활용하여12개의추천기준을도출하였다.마지막으로설문을통해각기준에대한이용자의선호도를조사하였다.설문의결과는다음과같다.첫째;대부분의학생들이북큐레이션서비스가도서관이용에필요하다고응답하였다.둘째;상위3개선호기준은‘관심키워드중심추천’;‘학년단위다대출’;‘교과연계도서목록다대출’이다.,박양하,한국도서관·정보학회지,한국도서관·정보학회,47,1,279,303,2016,문헌정보학,22,ART002094758
브랜드 경험으로 본 라이프스타일 숍 큐레이션 연구- 일본 무인양품을 중심으로 -,오승희,"다변화하는 사회구조로 인하여 가치소비와 경험이 중요하게 되면서 라이프스타일 숍의 등장하게 되었다. 이에 본 연구는 의·식·주의 경계가 희미해지는 현시점에서 라이프스타일 숍 큐레이션의 브랜드 경험 요소와 브랜드 표현 특성을 분석하여 한국 라이프스타일 숍의 방향성을 제안하고자 한다. 연구 대상은 라이프스타일 숍 무인양품이며, 연구 방법은 브랜드 경험의 5가지 유형과 브랜드 경험 특성 5가지를 무인양품을 5가지 큐레이션에 적용하여 정성적으로 분석한다. 연구의 결과 첫째, 상품과 공간 그리고 소비자의 가치 실현을 위하여 브랜드 경험을 중심으로 한 큐레이션을 제안해야 한다. 소비자의 니즈를 정확하게 분석하여 그들의 삶에 있어 라이프스타일 제안할 수 있는 브랜드로 세밀한 관점과 미학을 갖춰야 한다. 둘째, 브랜드의 기억과 큐레이션에서의 경험을 연결함으로써 큐레이션의 경험이 고스란히 브랜드 경험에 머물 수 있도록 해야 한다. 셋째, 브랜드는 소비자와 공유할 수 있는 브랜드의 키워드를 정의하여 소비자에게 브랜드 경험을 통해 라이프스타일을 제안해야 하며, 의․식․주 그 이상의 것을 복합적인 큐레이션을 통해 판매가 아닌 경험의 공간으로 제공해야 한다. 이러한 브랜드 경험은 다양한 경험요소를 통한 한국형 라이프스타일 숍 환경에 적용하여 소비자에게 직·간접적으로 제공하여 브랜드와 상호작용할 수 있는 브랜드 경험을 제시해야 할 것이다.",다변화하는사회구조로인하여가치소비와경험이중요하게되면서라이프스타일숍의등장하게되었다.이에본연구는의·식·주의경계가희미해지는현시점에서라이프스타일숍큐레이션의브랜드경험요소와브랜드표현특성을분석하여한국라이프스타일숍의방향성을제안하고자한다.연구대상은라이프스타일숍무인양품이며;연구방법은브랜드경험의5가지유형과브랜드경험특성5가지를무인양품을5가지큐레이션에적용하여정성적으로분석한다.연구의결과첫째;상품과공간그리고소비자의가치실현을위하여브랜드경험을중심으로한큐레이션을제안해야한다.소비자의니즈를정확하게분석하여그들의삶에있어라이프스타일제안할수있는브랜드로세밀한관점과미학을갖춰야한다.둘째;브랜드의기억과큐레이션에서의경험을연결함으로써큐레이션의경험이고스란히브랜드경험에머물수있도록해야한다.셋째;브랜드는소비자와공유할수있는브랜드의키워드를정의하여소비자에게브랜드경험을통해라이프스타일을제안해야하며;의․식․주그이상의것을복합적인큐레이션을통해판매가아닌경험의공간으로제공해야한다.이러한브랜드경험은다양한경험요소를통한한국형라이프스타일숍환경에적용하여소비자에게직·간접적으로제공하여브랜드와상호작용할수있는브랜드경험을제시해야할것이다.,오승희,브랜드디자인학연구,사단법인 한국브랜드디자인학회,18,1,29,42,2020,디자인,7,ART002569315
영화 콘텐츠 큐레이션과 메타데이터 표준 연구의 동향 분석 -예술경영 관점으로-,배승주,"본 연구는 국내 영화 콘텐츠 큐레이션 연구에 나타난 메타데이터 연구들을 찾아서 연도별로 내용과 변화를 예술경영의 관점에서 분석하는 것이다. 큐레이션과 추천시스템은 모두 그 바탕에 메타데이터의 기능이 작동하고 있다. 연구의 목적은 디지털 콘텐츠에서 큐레이션과 추천시스템이 어떻게 다른가를 확인하는 것이다. 연구절차와 방법은 ‘영화’와 ‘메타데이터’를 키워드로 논문을 검색하고, 이를 연도별 연구경향, 연구내용의 목적, 용도별 분석, 추천 방식의 유형에 따른 변화의 4단계로 분석하는 과정을 거쳤다. 연구 결과는 영화 메타데이터 연구는 이용자 측면의 연구에 관심이 높고, 도입단계, 추천방식 진화단계, 공유와 참여 단계로 발전하고 있으며, 영화 큐레이션은 검색지원, 콘텐츠 기반, 협력필터링, 하이브리드, 인공지능, 큐레이션의 6단계로 진화하였다는 결론을 얻은 것이다. 이 연구는 장르별 예술경영을 위한 메타데이터 개발에 기여할 것으로 기대한다.",본연구는국내영화콘텐츠큐레이션연구에나타난메타데이터연구들을찾아서연도별로내용과변화를예술경영의관점에서분석하는것이다.큐레이션과추천시스템은모두그바탕에메타데이터의기능이작동하고있다.연구의목적은디지털콘텐츠에서큐레이션과추천시스템이어떻게다른가를확인하는것이다.연구절차와방법은‘영화’와‘메타데이터’를키워드로논문을검색하고;이를연도별연구경향;연구내용의목적;용도별분석;추천방식의유형에따른변화의4단계로분석하는과정을거쳤다.연구결과는영화메타데이터연구는이용자측면의연구에관심이높고;도입단계;추천방식진화단계;공유와참여단계로발전하고있으며;영화큐레이션은검색지원;콘텐츠기반;협력필터링;하이브리드;인공지능;큐레이션의6단계로진화하였다는결론을얻은것이다.이연구는장르별예술경영을위한메타데이터개발에기여할것으로기대한다.,배승주,한국융합학회논문지,한국융합학회,11,6,163,171,2020,학제간연구,5,ART002595687
게이트키핑 이론의 재해석 : 뉴미디어 환경에서 큐레이션을 중심으로,윤하나; 정정주,"정보통신 기술발달과 미디어환경의 변화에 따라 전통 언론매체인 종이신문과 텔레비전의 이용률은 감소하고, SNS 등 뉴미디어 플랫폼을 중심으로 한 뉴스 소비 경향이뚜렷해지고 있다. 소셜미디어, 온라인 저널리즘, 뉴스의 다채널화 등 저널리즘의 특정한 주제들이 주목받지만 고전적인 언론 모델이 새로운 매체 환경에서 지니는 의미에대한 논의는 미진한 상황이다. 본 연구는 이와 같은 문제의식을 바탕으로 저널리즘 연구의 대표적 이론인 게이트키핑을 뉴미디어의 보편적인 정보 전달 방식인 큐레이션을통해 재해석해보고자 한다. 소수의 정보원과 채널의 희소성을 상정하는 게이트키핑 이론은 뉴스 접근성을 높이는 다채널 환경에 대한 믿음을 기반으로 외면 받고 있는 것이사실이다. 그러나 뉴미디어 환경의 뉴스 수용자들은 자신의 네트워크 내에서 적극적으로 뉴스를 소비하고 재생산함으로써 제도권의 게이트키핑 실천에 개입하는 한편, 또다른 게이트키퍼의 역할을 수행하고 있다. 본 연구에서는 뉴스 수용자 게이트키핑의구체적인 실천 형식으로서의 큐레이션에 주목하고, 이를 가능하게 한 뉴미디어와 매스미디어, 뉴미디어와 인간 행위자, 그리고 네트워크 내 인간 행위자들 간 상호작용을이론적으로 살펴보았다. 이러한 통합적 논의를 통해 향후 온라인 저널리즘 연구에 하나의 방향성을 제시하고자 한다.",뉴미디어 저널리즘; 게이트키핑; 큐레이션,윤하나,언론과학연구,한국지역언론학회,20,3,46,75,2020,신문방송학,6,ART002625784
창의·인성 교육기반의 디지털 융합 큐레이션 시스템에 관한 취약점 분석,김정인; 신승수; 윤정진,웹 서비스 사용자가 증가하면서 웹 애플리케이션을 공격하는 방법들이 여러 가지 유형들로 나타나면서 웹 애플리케이션 보안에 관한 중요성의 인식도 증가하고 있다. 정보통신기술 발달과 함께 도래한 지식정보사회는 급변하는 사회에서 창의성과 인성 교육에 필요한 웹사이트의 구축이 절실히 요구되고 있다. 본 논문에서는 창의․인성 교육기반의 디지털 큐레이션 시스템에서 제공하는 교육 콘텐츠에 대한 SQL Injection과 XSS에 대한 공격 방법과 취약점을 분석한다. 그리고 SQL Injection과 XSS에 대한 웹 공격에 대응하는 방법을 제시하고자 한다.,SQL Injection; XSS; 디지털 큐레이션; 웹 보안; 소셜 네트워크 서비스; 창의·인성,신승수,한국융합학회논문지,한국융합학회,6,4,225,234,2015,학제간연구,17,ART002022456
디지털 큐레이션 시스템을 활용한 영상기반 교육에 참여한 대학생의 창의⋅인성 변화 인식 연구,윤정진; 임홍남; 정수정,"목적 본 연구는 디지털 큐레이션 시스템을 활용한 영상기반 창의⋅인성 교양강좌에 참여한 대학생들의 창의⋅인성 변화에 대한인식을 살펴보았다.
방법 이를 위하여 본 교양강과를 수강한 B시의 D대학교 대학생에게 설문을 배부하였으며, 그 중 자발적 참여자 56명이 연구 참여자로 선정되었다. 이 중 응답이 부족한 1부의 설문을 제외하고 최종 55명의 연구 참여자의 설문을 개방코딩 방법으로 분석하였다.
결과 본 교양강좌를 수강한 대학생들은 여러 상황을 경험하고 새로운 산출물을 생성하게 되었다는 점에서 창의적 문제해결력이 증진되었으며, 자신의 생각을 돌아보고, 자기이해를 재정립해나가게 되었다고 밝혔다. 또 다르게 생각하고, 폭넓게 수용하며 관점이확장되었다고 밝히며 창의⋅인성이 함양되었다고 하였다.
결론 본 연구는 변화하는 시대 흐름에 맞춰 비대면 온라인 학습 플랫폼으로써의 교육 방법으로 요구되는 창의⋅인성을 교육할 수있는 방법에 대한 소개와 함께 그에 참여한 학생들의 이야기를 들어봄으로써 미래 창의⋅인성에 대한 방향성을 제시해주는 길잡이가 되어줄 연구로서 의미가 있다.",창의⋅인성; 디지털 큐레이션 시스템; 대학 교양 교육,윤정진,학습자중심교과교육연구,학습자중심교과교육학회,21,16,567,592,2021,교과교육학,2,ART002747327
콘텐츠 큐레이션 플랫폼 성능평가 알고리즘,최종호,"본 논문에서는 콘텐츠 큐레이션 플랫폼의 성능평가 알고리즘을 제안하였다. 성능평가는 초기조건과 종료조건을 설정하고, 4개의 파라미터를 측정하여 수행하였다. 성능평가에 사용되는 파라미터는 서비스 응답속도, 응답결과 정확도, 분석결과 정밀도, 분석결과 재현율이다. 제안한 성능평가 알고리즘의 유효성을 확인하기 위해 118,738건의 데이터베이스를 직접 구축한 후, 인터넷에서 콘텐츠를 오픈하여 이를 클릭한 사용자 행위를 기반으로 실험을 수행하였다. 실험에 사용된 페이지 뷰는 6,975,365건이었다, 실험결과, 4개의 파라미터를 이용하면 콘텐츠 큐레이션 플랫폼의 종합평가와 단위평가가 객관적으로 수행될 수 있음을 확인하였다.",contents; curation; parameter; performance evaluation; platform,최종호,한국정보전자통신기술학회 논문지,한국정보전자통신기술학회,11,6,658,663,2018,전자/정보통신공학,0,ART002418022
패션쇼핑 과정에서 큐레이션 서비스의 역할 -만족의 조절된 매개효과-,선준호; 윤지현; 이규혜,"This study investigated the effects that motivation to use curation services had on perceived service quality, service satisfaction, purchase intention, and word of mouth (WOM) intention. In particular, the service satisfaction variable was verified to be a mediator in relation to the perceived service quality, purchase intention, and WOM intention, and this moderated mediation effect was verified by inserting the variables of product price and product quality satisfaction into the study. It was found that utilitarian motivation had a positive impact on both the perceived rapidity and accuracy of the service, and hedonic motivation was only significant in relation to the accuracy of service. In terms of how perceived service quality affects both purchase and WOM intentions, rapidity had a positive effect on purchase intention, but the relationship with WOM intention was insignificant; accuracy of service, however, showed a positive effect in relation to all variables. Furthermore, with the mediation effect of service satisfaction, it was shown that service satisfaction played a mediating role in the relationship between rapidity and accuracy, as well as between purchase and WOM intentions. Finally, as a result of checking the moderated mediation effects of product price satisfaction and product quality satisfaction, only price satisfaction had a significant moderating effect while service satisfaction mediated the relationship between purchase intention. This study differs from previous studies in that it conducted in-depth verification of the effects moderated by other variables as well as the simple mediating path of the service satisfaction variables. It is significant in that it presents theoretical implications and provides academic data in the fields of marketing and consumer behavior.",큐레이션 서비스; 지각된 서비스 품질; 구매의도; 서비스 만족; 이용자 동기; 구전의도,윤지현,복식,한국복식학회,71,5,1,19,2021,생활과학,3,ART002768616
공동체 기억보존센터로서의 도서관 운영 및 큐레이션 제공 방안 연구,곽우정; 노영희,"본 연구에서는 공동체의 삶의 기억 수집․보존․관리 체계 구축 지원이라는 정책 과제를 기반으로 지역별 역사․향토자료 콘텐츠 수집과 공유, 큐레이션 서비스를 제공하는 공동체 기억보존의 중심지로서의 도서관 구축의 필요성을 제시하고자 하였다. 이를 위해, 문화원 및 지역기록관 등 지역 기반 자료를 서비스하고 있는 기관의 자료 수집 및 관리, 운영에 관한 현황을 파악하고, 도서관의 큐레이션 서비스 사례와 현황을 조사․분석하였다. 연구 결과를 통해 제안한 논의는 다음과 같다. 첫째, 문화원에서는 축제나 문화예술 행사, 문화예술 교육사업, 지역주민의 예술 활동 사업 등과 같은 사회교육 측면에서의 외부적 요구가 증대되고 있어 향토자료 조사 연구 및 발간을 비롯한 관리 업무까지 병행되어 관리가 쉽지 않은 실정이다. 따라서, 지역주민에게 정보서비스는 물론 문화프로그램 제공, 정보공유 공간 제공, 취약주민에 대한 서비스 제공 등 상당히 다양한 역할을 수행하고 있는 공공도서관에서 지역의 다양한 자료를 수집․보존하는 역할을 수행하는 것 이 필요하다. 기존 도서관의 경우 체계적인 자료 수집 방안을 구축하고 있기 때문에, 현재 문화원 및 각종 문화기관과의 협력을 통해 자료 관리를 원활히 운영할 수 있을 것으로 파악된다. 둘째, 도서관이 자료를 구축하고, 자료 이관이 어려운 자료가 많으며, 모든 자료를 도서관으로 집중하여 구축하는 것은 사실상 어렵기 때문에, 도서관과 지역 행정기관의 자료, 기타 유관기관, 개인의 자료를 모두 온라인 데이터베이스로 구축하여 자료에 쉽게 접근할 수 있고, 언제든지 도서관에서 열람할 수 있도록 모으는 방안이 필요할 것으로 파악된다.",공동체; 기억보존센터; 큐레이션; 공공도서관; 향토자료,곽우정,한국비블리아학회지,한국비블리아학회,31,2,53,70,2020,문헌정보학,1,ART002599514
O2O 쇼핑을 위한 소셜 큐레이션 경험 디자인에 대한 연구- O2O 소셜 큐레이션 어플리케이션 디자인을 중심으로 -,"이지현; 임채린; 임채린
							

							1","크로스 채널 시대를 지나 옴니(Omni) 채널 시대가 도래하였다. 크로스 채널 시대에는 채널 간 협업하고 각 채널에 접근하는 고객에게 동일한 서비스와 상품을 제안하였지만 각 채널 간의 궁극적인 통합이 이루어지진 않았다. 하지만 옴니 채널 시대가 도래하며 모든 접점 채널들이 지속적으로 연결되며 끊김없는 (Seamless) 사용자 관리가 가능해졌다. 사용자들은 합리적인 구매를 위해 쇼핑 과정에서 온라인 채널과 오프라인 채널을 혼용하여 사용하는 O2O 쇼핑을 자연스럽게 하기 시작하였다. 따라서 O2O 쇼핑은 차별화가 아닌 필수 전략이 되었다. 이처럼 쇼핑 환경이 변화함에 따라 쇼핑 서비스 구성 요소를 온라인/오프라인/통합 환경에 따라 파악할 필요가 있다. 본 연구는 앞서 언급한 쇼핑 서비스 구성 요소를 온라인, 오프라인 환경에 따라 세부적으로 조사해보고 실제 소비 금액이 많은 사용자들을 모집하여 심층 인터뷰를 진행하였다. 그 결과 주요 생애주기를 맞아 쇼핑 횟수가 많고 금액이 큰 사용자들을 통하여 O2O 쇼핑에 대한 니즈를 파악하였다. 이를 바탕으로 O2O 쇼핑에서의 플로우 모델과 이에 따른 생애주기 맞춤형 쇼핑 정보 큐레이션 서비스를 어플리케이션으로 제안하였다. 그 후 주요 서비스 요소인 쇼핑 정보 추천, 저장, 관리, 오프라인에서의 서비스 활용, 소셜 커뮤니티를 활용한 쇼핑 정보 추천 등의 기능을 프로토타입을 활용하여 서비스 차별성, 사용성, 활용 가능성 측면에서 서비스의 실효성을 검증하였다.",O2O Shopping; Omni Channel; Curation Service,임채린,디지털디자인학연구,한국디지털디자인학회,15,4,83,96,2015,디자인,15,ART002056969
연구콘텐츠 라이프 사이클 모델 개발: 한국과학기술정보연구원 콘텐츠 큐레이션 센터를 중심으로,orcid 바로가기; 김재훈; 박지영; 윤소영; 이혜림; 이혜원; 황혜경,"본 연구에서는 KISTI 콘텐츠 큐레이션 센터의 업무를 중심으로 콘텐츠 라이프 사이클에 맞는 큐레이션 모델인 KISTI CLCM을 개발하였다. 이를 위해 앞서 개발된 모델 DCC, DCC&U, UC3, DCN 모델 등을 살펴보고, 디지털 큐레이션 센터의 업무와 연결되는 모델들의 장점을 도출하였다. KISTI 콘텐츠 큐레이션 센터의 업무담당자들과의 집단 면담을 통해 센터에서 다루는 콘텐츠의 특징을 파악하고 현 업무의 성취정도를 확인하였다. 또한 본 연구에서는 UC3 모델을 기반으로 KISTI 콘텐츠 큐레이션 웨이브를 개발하여 이용자 중심의 서비스를 발굴하고 디지털 자원에 새로운 가치를 추가하여 활용성을 높일 수 있는 방안을 제시하였다.",콘텐츠 라이프 사이클; 콘텐츠 큐레이션 모델; 콘텐츠 큐레이션 웨이브; 한국과학기술정보연구원,이혜원,정보관리학회지,한국정보관리학회,36,3,203,228,2019,문헌정보학,1,ART002510275
비휘발적 소셜 큐레이션 서비스가 가능한 대화형 상거래 플랫폼 개발,유기동,"동일한 관심사를 갖는 개인 또는 그룹에서 생성 및 공유한 정보를 선별하여 제공하는 소셜 큐레이션 서비스는, 최근 많이 사용되고 있는 SNS 기반 채팅 기능과 접목될 경우 시너지적 효과를 기대할 수 있다. 특히 이러한 기술이 제품 및 서비스를 판매하는 인터넷 쇼핑몰에 적용될 경우, 구매자는 채팅을 통해 보다 신뢰할 수 있는 정보를 실시간으로 제공받을 수 있으며, 판매자는 자사 제품 및 서비스에 관심을 갖는 고객에게 차별적이고 풍부한 정보를 지속적으로 제공할 수 있다. 본 연구는 소셜 큐레이션 서비스를 채팅 기반으로 제공하는 대화형 상거래 플랫폼을 제시한다. 제시된 상거래 플랫폼은 상점 및 상품별로 채팅 채널을 구성하여 상점 및 브랜드, 그리고 세부 상품에 대한 신규 및 기존 고객의 문의에 실시간으로 대응할 수 있고, 해당 채널에 가입된 고객에게 차별화된 판매전략을 지속적으로 구사할 수 있도록 구성되었다. 특히 MongoDB를 이용하여 채널별 수록된 정보와 채팅 내역이 반영구적으로 저장 및 보관되도록 하여, 구매자가 언제든 해당 채널에 수록된 제품 정보와 채팅 내역을 검색 및 참고할 수 있도록 구성하였다.",소셜 큐레이션 서비스; 대화형 상거래 플랫폼; 소셜 네트워크 서비스; 소셜 상거래; MongoDB,유기동,한국전자거래학회지,한국전자거래학회,23,3,145,157,2018,컴퓨터학,0,ART002378453
트랜스미디어 시대에서 에디큐레이션의 의미에 대한 연구 - 출판 및 만화 콘텐츠를 중심으로 -,박세현,"인터넷 및 디지털 미디어의 환경에서 미디어 수용자는 동일 콘텐츠를 다양한 플랫폼으로 이용하고 있다. 이처럼 여러 장르의 콘텐츠가 디지털 미디어의 기반에서 융합, 조합, 변형, 분화, 복제 등의 과정을 거치면서 새로운 콘텐츠의 형태로 전환되는 것을 트랜스미디어라고 한다. 트랜스미디어 시대에서 성공하는 콘텐츠를 만들기 위해서는 에디큐레이션의 작업이 필요하다. 에디큐레이션은 큐레이터의 큐레이션 작업에 편집과 의미를 부가하는 작업 행위이다.
그런 점에서 이 논문은 트랜스미디어 시대에서 출판 및 만화 콘텐츠의 에디큐레이션에 대한 정의와 의미를 분석했다. 에디큐레이션은 디지털 미디어 환경에서 콘텐츠의 생산자가 곧 소비자며, 소비자가 곧 생산자인 프로컨슈머/프로듀저를 유도하는 역할을 담당하는 프로세스다. 디지털 플랫폼과 디바이스의 다양화, 디지털 1인(혹은 SNS) 미디어의 등장 등은 출판 및 만화 콘텐츠에도 다양한 방식의 에디큐레이션을 요구한다. 미디어 생산자(혹은 수용자)의 의도에 따라 콘텐츠는 복제, 짜깁기, 분해, 해체, 하이퍼텍스트, 압축, 재구성 등의 과정을 거쳐서 새로운 콘텐츠로 탄생한다.
이처럼 에디큐레이션의 작업을 거친 출판 및 만화 콘텐츠는 미디어 생산자의 작업 방식은 물론, 미디어 수용자의 콘텐츠 독법에도 영향을 미친다는 점에서, 트랜스미디어 시대의 에디큐레이션은 중요한 의미를 지닌다. 출판 콘텐츠에서 에디큐레이션 작업은 챕터나 단락의 논리성 파괴, 구어체의 문장, 카드 뉴스의 활용, 동영상 및 미디어 콘텐츠의 변형 등이 있으며, 만화 콘텐츠에서는 칸의 파괴, 말풍선, 의성어, 의태어의 다양한 변형 등을 들 수 있다.",트랜스미디어; 에디큐레이션; 디지털 미디어; 콘텐츠,박세현,만화애니메이션연구,한국만화애니메이션학회,,44,235,261,2016,예술일반,2,ART002153252
