제목,저자_상세,초록,키워드_상세,저자,저널명,발행기관,권,호,시작페이지,종료페이지,발행년도,주제분야,인용횟수,논문ID
‘메타버스 기술을 이용한 전시 공간과 활용 가능성’에 대한 연구,김기라,"21세기 들어 새로운 개념과 기술로 각광받는 메타버스는 기술의 혁신적인 발전과 더불어, 또한 팬데믹 현상과 맞물려 폭발적인 가능성을 인정받고 현대 산업의 다양한 분야에 상용 서비스를 개시하기에 이르렀다. 문화예술 분야 역시 메타버스의 신개념과 신기술의 자장 안에 놓이게 되었고, 그 중에서 메타버스의 가상영역은 특히 전시 공간의 새로운 확장과 관람객의 큐레이션(curation) 역할을 주어지게 했다는 점에서 주목할 만한 가치를 가지고 있다. 이미 메타버스 서비스가 제페토, 스페이셜 등 업계 서비스로 상용화 되었으며, 전시 체험의 새로운 감각을 확장했다는 것은 여러 사례를 통해 입증되었다. 메타버스 기술은 또한 기존의 물리적인 시 공간과 제약에서 벗어나 대안적이면서 획기적으로 전시공간을 공유와 향유 중심인 공간으로 바꿔나가고 있다. 실물과 물질화 위주의 전통적 대면의 아날로그 전시방식을 비 물질화 된 플랫폼 전시라는 새로운 개념의 전시 디자인과 체험 공간으로 발전시키고 있는 것이다. 원고는 메타버스 서비스가 전통적인 전시 공간의 역할에 새로운 문제를 제기하며, 그 활용과 가능성을 제시함으로써 관람자 중심의 새로운 전시 관람 행태를 형성하고, 메타버스의 활용과 메타버스 기술이 미치는 미래 전시 공간과 활용 가능의 범주를 미술관과 박물관이 디지털 아카이브 공간에 적용 가능하도록 재고하는 단초를 제공하며, 나아가 예술 작품의 원본성의 가치를 공고히 할 수 있는 가능성에 대해서도 예측해 보고자 한다.",메타버스; 현대미술과 공간; 미래전시; 전시공간; 디지털 플랫폼; 스마트 스페이스,김기라,한국디자인리서치,한국디자인리서치학회,6,4,152,160,2021,디자인,27,ART002797467
계층분석방법을 활용한 사서교사 역량의 우선순위에 관한 연구,강봉숙; 이병기; 이승민; 임정훈,"본 연구 목적은 사서교사 역량을 재정의하고, 역량 우선순위를 분석하여 사서교사 양성 및 재교육에 대한 시사점을 도출하는 데 있다. 본 연구를 위하여 사서교사를 대상으로 AHP를 활용한 설문조사를 실시하였다. 사서교사들은 직무의 상위 계층 영역 중 정보 전문가, 교사, 경영자, 협력적 리더 순으로 우선순위를 인식하고 있었다. 하위 계층별로는, 장서개발․관리․보존, 교수․학습 매체 제작, 정보서비스, 도서관협력수업, 도서관활용수업, 콘텐츠 큐레이션의 우선순위가 높게 나타났다. 특히, 학교도서관에서는 교육과정을 지원하기 위해 장서를 개발하고 정보 자원을 제공하는 것이 중요한 역량으로 조사되었다. 이에 온․오프라인 장서를 효과적으로 관리하고 학교도서관 자원을 활용하여 다양한 교수 매체 제작 및 서비스를 제공할 수 있는 역량 함양이 필요하다는 점을 고찰했다. 이를 바탕으로 사서교사 양성 및 재교육에 대한 시사점을 발견할 수 있었다.",계층분석방법; 사서교사; 학교도서관; 연수; 역량,임정훈,한국도서관·정보학회지,한국도서관·정보학회,52,2,127,144,2021,문헌정보학,11,ART002730473
웹 트래픽 분석을 통한 공공도서관 웹사이트 이용행태에 관한 연구,강문실; 김성희,"본 연구의 목적은 공공도서관 웹트래픽을 분석함으로써 공공도서관 웹사이트 이용행태를 분석하는 데 있다. 이를 위해 구글애널리틱스와 그로스해킹 기법을 이용하여 A 공공도서관 웹사이트 로그를 2021년 8월 1일부터 10월 31일까지 3개월간 웹 트래픽을 분석하였다. 연구결과 18-24세, 25-34세의 젊은 연령에서 신규회원 가입이 높은 결과를 기록하였고, 외부 유입에서는 SNS를 통한 유입율이 높은 것으로 나타났다. 요일 및 시간대별 접속율을 분석한 결과 가장 유입율이 많은 시간대는 수요일-금요일 사이의 오전 10시-11시 사이인 것으로 나타났다. 접속매체로는 모바일(64.90%)을 이용한 접속율이 상당히 높았지만 그와 동시에 이탈율(27.20%)이 평균(24.93%)보다 높고, 체류율(4분 33초)은 평균(5분 22초) 이하로 측정되었다. 마지막으로 도서관에서 주력하여 제작 및 홍보하고 있는 독서문화 행사나 온라인 북큐레이션의 이용율은 매우 저조한 것으로 나타났다. 이러한 연구결과는 미래의 공공도서관 웹사이트 개선을 위한 기초자료로 활용될 수 있을 것이다.",공공도서관; 웹사이트; 웹트래픽; 구글 애널리스틱스; 그로스 해킹,강문실,한국비블리아학회지,한국비블리아학회,32,4,189,212,2021,문헌정보학,3,ART002790817
4次産業革命時代の言語教育方法論の研究－「初級日本語の教育」を中心に－,설근수,"本研究は、4次産業革命時代に日本語教育の言語学習方法」として、主に「初級日本語(生活日本語)」という科目の実例を活かして、この時代が要求する言語教育方法論とは何かを中心に研究したものである。今日注目されている「4次産業革命」の核心分野と「教育3.0(開放･共有･参与･疎通)」や「言語の四技能(読む･書く･話す･聞く)」のような理論とを融合して考察してみた。これにより、学習者の主導的、かつ能動的な学習の動機付けを引き出せる教育方法を提案したいのである。 世の中が目まぐるしいほど変転するなかで、このスマートモビリティ(Smart Mobility)」時代が要求する言語教育法とは何かを考察した。学習する環境は、確かに変わったのである。これにともない、教育を実行する現場も変わるべきであり、この時代をさきどり、この環境に基づいていかに教育方法も変貌させるかが、本研究の狙いでもあった。それは、「初級日本語(生活日本語)」という科目を対象に、いかに分かりやすく教え、いかに分かりやすく学習することができるかを模索しようと工夫したのである。 本研究は、「4次産業革命時代の言語教育方法論の研究」として、「初級日本語教育」を中心に、その新しいパラダイムの日本語教育方法論を提案したいのである。 上記のような内容を総合するときに，文字言語,音声言語の向上を極大化できるという点で，この時代が求める学習方法が何なのか，継続的に研究すべきであろう。
본 연구는 “4차 산업 혁명 시대의 언어 교육 방법론의 연구”로서, “초급 일본어 교육”을 중심으로, 그 새로운 페러다임의 일본어 교육 방법론을 연구하는 것을 목적하에, 다음과 연구 결과를 알 수 있었다.
1.일반적으로 개인 교수가 독자적으로 MOOC자료를 개발내지 작성은 많은 시간과 노력이 필요함은 자명하다. 이러한 번거로움을 일거에 해결할 수 있는 장치가 “소셜 큐레이션 기반”의 자동 검색 방법을 취했다는 점이다.
2.소셜 큐레이션기반에 의해 검색된 다양한 컨텐츠(특히, 동영상 MOOC자료)를 학생들의 수준별로 제공할 수 있어, 동기 부여의 학습효과가 있다.
3.SNS기반으로 각종 학습 자료를 제공할 수 있어, 언제 어디에서나 교육환경을 만들 수 있다는 점이다.
4.SNS기반에서 교수와 학생, 학생과 학생간의 문자언어를 이용하여 상호작용할 수 있다는 점이다.
5.플립러닝과 같은 예비 학습이 가능하기 때문에, 학생들의 학습 방법을 다양하게 제공할 수 있다는 점이다.
6.학습의 장이 “스마트폰”을 중심으로 전개되기 때문에, 그 학습동기 부여는 지대하다.
위와 같은 내용을 종합해 볼 때, 문자 언어, 음성 언어의 향상을 극대화할 수 있다는 점에서, 이 시대가 요구하는 학습 방법이 무엇인지 지속적으로 연구되어야 할 것이다.",4次産業時代; スマートモビリティ; 言語教育; 初級日本語; 教育3.0; 言語の四技能;4차산업혁명시대;스마트모빌리티;언어교육;초급일본어;교육3.0;언어4기능,설근수,일본문화연구,동아시아일본학회,,72,73,87,2019,일본어와문학,4,ART002514107
신뢰성 향상을 위한 블로그 포스팅 시스템 개선 방향에 관한 연구 - 코스메틱 제품 큐레이팅을 중심으로 -,김면; 박지유,"최근 제어할 수 없을 정도의 데이터 증가로 전 세계가 빅데이터에 집중하고 있다. 이와 함께 정보를 다시 분류하여 걸러주는 필터 역할의 큐레이션이 주목받고 다양한 직업군을 생성하고 있다. 그중에서도 블로그 포스팅 은 많은 사람이 다양한 정보를 쉽게 접하면서 새로운 큐레이션 수단으로 주목받았다. 그러나 무분별한 포스팅의 증가와 광고성이 짙어진 문제점이 대두하면서 블로그를 통한 정보전달은 신뢰성을 상실하고 있다. 본 연구에서는 누구나 접근이 편리하여 효율적으로 정보를 공유한다는 큰 장점이 있는 블로그 포스팅의 신뢰성을 높이고, 다가오는 폭발적인 데이터의 시대에서도 맞춤형 정보를 제공할 수 있는 블로그 포스팅 시스템 개선 방향에 대하여 연구하였다. 먼저, 코스메틱 제품 정보를 연구 대상으로 두고, 같은 제품에 대한 후기를 비교·분석하여 현재 블로그 포스팅 시스템의 문제점을 도출하였다. 분석결과 블로그를 통한 정보는 객관적이기보다는 사용자 주관에 의한 전달이 주를 이루고 있었다. 이는 곧 정보전달자와 수용자 간의 공통 카테고리를 찾기 힘들다는 것을 의미한다. 그러므로 신뢰성 향상을 위해서는 주관성을 배제한 객관적 방향으로의 시스템 전환이 필요함을 알 수 있었다. 신뢰성 향상을 위한 블로그 시스템 개선을 위하여 전문정보에 기초하여 객관적으로 제공 가능한 항목들을 도출하였다. 도출된 큐레이션 항목들을 활용하여 객관화된 개선 매뉴얼을 제시하였다. 또한, 개선 매뉴얼의 적용을 통해 블로그 포스팅의 신뢰도 변화를 확인하였다. 새롭게 제시된 블로그 시스템 개선안은 블로그를 통한 다양한 정보 전달에서도 신뢰성을 높이는 큐레이션 도구가 될 것으로 기대한다.",Curation; Blog Curation; Blog Posting System,박지유,디지털디자인학연구,한국디지털디자인학회,14,3,727,736,2014,디자인,1,ART001896849
비대면 IoT 피부진단-치료 AI 서비스 접근방향 연구,남현우,"4차 산업혁명 시대에 비대면 원격진료는 미래 성장동력 산업이다. 본 연구의 배경은 원격진료 산업의 확장, IoT, AI 큐레이션 기술 발전, PSS 산업의 성장 등 3가지로 구분하여 연구를 진행하였다. 본 연구는 피부진단과 치료를 빅데이터와 사물인터넷(IoT), 인공지능(AI)를 결합한 서비스 방향성을 도출하는데 목표가 있다. 따라서 본 연구에서는 더모스코피 검사법을 기반으로 한 IoT, AI 서비스를 중심으로 연구를 진행하였다. 연구의 진행에 따른 결과값은 피부진단-치료의 국내외 현황을 고찰해 보고, 전문가 집단심층면접(FGI) 결과값을 바탕으로 3가지의 방향성을 제안하였다. 첫째, 피부진단-치료 사용자 라이프 스타일 분석 방법론을 통해 개인 맞춤형 사용자의 경험 가치와 수요를 발굴해야 한다. 둘째, 피부진단-치료 평가지표/프로파일 패턴 서비스 모델링 개발을 위해 프로파일 패턴 DB를 개발해야 한다. 셋째, 피부진단-치료 IoT 제품 개발 및 인공지능 학습 DB를 기반으로 개인맞춤형 피부진단-치료 큐레이션 플랫폼 서비스를 구축해야 한다. 본 연구에서 제시된 피부진단-치료 IoT, AI 큐레이션 등은 전자기기 디자인 융합기술, 인포테인먼트 등 미래 혁신상품 프레임워크에 기반 연구가 될 것이다.",피부진단-치료; 비대면; 인공지능; 사물인터넷; 서비스 디자인,남현우,한국디자인리서치,한국디자인리서치학회,5,3,165,176,2020,디자인,1,ART002632087
대학의 미래교육을 위한 핵심 교수역량 진단지표 개발,김은희; 박상아; 임성태,"4차 산업혁명 및 지능정보화시대의 본격화로 교육환경이 급격하게 변화됨에 따라 이를 반영할 수 있는 대학의 핵심 교수역량 및 진단지표에 대한 개발․개선이 강조되고 있다. 이에 본 연구에서는 A대학의 교수역량 진단도구 개선을 중심으로 미래교육 환경에서 어떠한 핵심 교수역량이 요구되는지 도출하고, 이를 진단하기 위한 진단지표를 제안하였다. 최종적으로 제시된 미래교육의 핵심 교수역량 진단지표는 크게 5개의 역량군 1) 수업설계 역량, 2) 수업운영 역량, 3) 학생이해 역량, 4) 자기성찰 및 수업개선 역량, 5) 공동체 역량이며, 각 역량군과 연관된 10개의 진단항목은 1) 변화대응 수업설계, 2) 교수․학습 자료개발, 3) 교수 전문성 개발 및 혁신, 4) 학습활동 촉진, 5) 학생에 대한 애정과 존중, 6) 학생과의 의사소통․전략적 촉진, 7) 수업진단 및 자기성찰․변화/혁신, 8) 수업개선 활동, 9) 공동연구․참여문화, 10) 글로벌 공유․확산으로 이 항목을 측정하기 위한 총 50개의 행동지표로 구성되었다. 본 연구를 통해 신규 진단지표로 도출된 대학의 미래교육을 위한 핵심 교수역량 진단지표를 중심으로 정리하면 다음과 같다. 학습자 참여 중심의 새로운 교수법 적용과 융․복합 교과목 개발 등 수업설계를 위한 유연한 태도를 갖는 것이 제시되었다. 또한, 미래교육 환경변화의 이해, 테크놀로지 활용 능력, 디지털 큐레이션, 수업의 개선을 위한 데이터 수집 및 분석 능력이 제시되었다. 아울러, 학문공동체의 일원으로서 다양한 기관과의 공동연구, 지역사회 참여, 글로벌 공유․확산을 위한 네트워크 구축 및 강의공개 등이 제시되었다. 이와 같이 본 연구에서 제시한 ‘대학의 미래교육을 위한 핵심 교수역량 진단지표’는 미래교육에 적절히 대응하기 위한 교수역량 기준이 되는 핵심 지표로서 기능할 것으로 판단되며, 이를 각 대학 정책에 맞게 발전시켜 교수역량 진단도구로 유용하게 활용할 수 있을 것이다.",미래교육; 핵심 교수역량; 교수역량 진단도구; 교수역량 진단지표; 교수역량 개발,김은희,교육정보미디어연구,한국교육정보미디어학회,27,4,1221,1248,2021,교육학,13,ART002792290
국가R&D보고서 기재항목에 관한 연구,orcid 바로가기; 이강산다정; 황혜경,"본 연구는 국가연구개발사업 성과로 발생한 최종보고서 기재항목 기준을 마련하여 데이터베이스 품질 향상과 관리 효율성 제고에 기여하고자 한다. 이를 위하여 과학기술정보통신부의 49개 산하기관에서 제출한 최종보고서를 수집하고 기관별 샘플을 선정하였다. 과학기술기본법 시행규칙의 최종보고서․요약서 서식과 대조하여 구성요소와 기재항목을 정립하고, 국가연구개발정보표준과 연계현황을 분석하여 최종보고서의 고유항목을 도출하였다. 기재항목은 중요도에 따라서 주요, 선택으로 구분하고 기재항목의 기입 위치를 제안하였다. 이와 같이 최종보고서 기재항목의 표준화가 진행되면, 데이터베이스 구축 시 메타데이터 추출 자동화와 보고서 메타데이터의 품질 향상을 기대해볼 수 있다.",국가연구개발; 연구보고서; 표준; 국가연구개발정보표준,이강산다정,한국도서관·정보학회지,한국도서관·정보학회,51,4,211,230,2020,문헌정보학,1,ART002662892
학술논문 통합 DB 구축을 위한 메타데이터 스키마 비교 분석,orcid 바로가기; 김정환; 이강산다정; 임석종; 최원준; 황혜경,"국내외 학술논문을 서비스하는 국가과학기술정보센터(NDSL) 데이터베이스는 다양한 정보원으로부터 수집된 데이터가 분산적으로 수집, 구축 및 관리되고 있다. 본 연구에서는 분산된 학술논문 DB를 분석하여 논문데이터를 고부가가치화하고 효율적으로 관리할 수 있는 통합 DB 스키마 도출을 위하여 현재 구축되고 관리되는 학술논문 DB 스키마 및 DB 메타데이터를 분석하였다. 또한, 현재 구매하여 보유하고 있는 Web of Science와 SCOPUS 스키마를 활용하여 비교, 분석을 통한 최종 학술정보 데이터 항목을 정하였다. 본 연구를 통하여 구축되고 서비스되는 학술정보 데이터 항목이 논문, 저자, 초록, 기관, 주제, 저널, 참고문헌 7가지로 요약 도출되었으며 구축중인 핵심콘텐츠로 정의하였다. 본 연구를 통하여 통합 DB 스키마가 만들어졌으며, 향후 이 연구 결과는 고품질의 학술논문 통합 DB 컬렉션 구성과 시스템 최적화 설계를 위한 기반 자료로 활용하고자 한다.",과학기술정보; 논문 데이터; 학술논문; 문헌 정보; 정보 서비스,최원준,한국콘텐츠학회 논문지,한국콘텐츠학회,20,2,689,699,2020,학제간연구,5,ART002563412
고전소설 콘텐츠의 OTT 서비스와 그 미래- 구독형 서비스 넷플릭스와 왓챠의 영화를 중심으로 -,정혜경,"이 글의 목적은 OTT 서비스의 원리와 구조에 기반을 두고 고전소설 콘텐츠의 활성화 방안을 탐색함으로써 고전소설의 미래를 여는 데 있다. 이는 고전소설 콘텐츠의 향유 로드를 확충하는 방법론적 모색인 동시에 고전소설 연구의 또 다른 관점과 방향에 관한 시론이다.
우선, 구독형 OTT 시장에서 스트리밍되는 고전소설 영화와 기본 정보를 개괄함으로써 전반적인 유통 상황을 조감하였다. 2021년 7월 기준, 넷플릭스와 왓챠를 통해 7.6%(10편)의 고전소설 영화가 서비스되고 있다. 이 가운데 왓챠의 최근 한 달간 시청률 5%에 든 작품은 <전우치>, <방자전>, <마담 뺑덕>이다. 그러나 고전소설 영화의 OTT 시장 진입률과 흥행 성적은 그 규모와 파급력에 비해 높지 않았다. 이어 마이크로 장르, 비슷한 콘텐츠, 이용자의 경험으로 구성된 평점과 코멘트를 중심으로 고전소설 영화의 유통과 소비 형태를 분석했다. 고전소설 영화는 OTT 플랫폼별로 새로운 장르와 의미를 부여받고 또 다른 소비 맥락을 형성하며 유통되었다. 하지만 개별 콘텐츠의 주요 성격과 해석에 바탕을 둔 메타데이터의 보강, 내적 친화성을 중심으로 한 비슷한 콘텐츠의 재구성, 이용자의 경험을 보다 적극적으로 수용한 추천 알고리즘의 설계가 필요한 것으로 나타났다.
고전소설 콘텐츠를 활성화하기 위해서는 고전(소설)에 관한 인식적 전환과 전략적 접근이 요구되었다. 이를 위해서는 고전소설 콘텐츠의 향유 원리에 토대를 두어 한국 영화사적 맥락에서 향유 로드를 구축해야 한다. 또한, 콘텐츠의 주요 특징과 이용자 해석에 기초한 메타데이터를 발굴하여 수용의 논리적 인과성을 마련하고, 소비 라인을 다변화하되 선택적 공략으로 접근성과 주목성을 높이는 전술이 필요했다. 끝으로, 달라진 미디어콘텐츠 제작, 유통, 소비 형태를 고려한 새로운 연구 방향과 관점의 전환이 요청되었다. 이에 고전의 범주 재구성에 대한 논의와 더불어 고전소설의 마이크로 장르 개발과 큐레이션 작업을 학술적 차원에서 수행할 것을 제안하였다.",고전소설 콘텐츠; 영화; OTT; 넷플릭스; 왓챠; 유통; 소비; 메타데이터; 마이크로 장르,정혜경,열상고전연구,열상고전연구회,,75,45,90,2021,기타국문학,10,ART002773934
문화예술 중심 인성교육교양강좌를 개발하기 위한 프로그램 구성,"1; 윤미승; 윤미승
							

							3; 윤정진; 윤정진
							

							2","본 연구는 창의인성 큐레이션 C-crepe를 활용하여 대학생의 ‘문화예술 중심의 인성교육 교양강좌 운영을 위한 온라인 상호작용 요소(C-mooc 상호작용 요소)를 탐색 하고자 한다. C-mooc은 본 연구자들에 의해 기 개발된 창의·인성 디지털 큐레이션(C-crepe, http://crepe.tu.ac.kr)을 기반한 공개강좌 콘텐츠를 의미하는 것이다. C-mooc 상호작용 모형 개발을 위해 창의·인성 디지털 큐레이션 C-crepe에서 실행되고 있는 상호작용 유형과 K-MOOC 상호작용에서의 요구를 분석하여 이를 통해 문화예술 중심의 인성교육 교양강좌를 운영하기 위한 최적화된 C-mooc 상호작용 모형을 개발하고자 한다. 본 연구에서 개발한 C-mooc 상호작용 요소는 3가지 영역으로 구성하였다. 첫째, 학습자-콘텐츠 영역으로 인성적 요소를 반영한 주제별 다양한 콘텐츠를 스스로 선택하도록 구성하여 학습자의 자율성을 강조하였다. 둘째, 교수자-학습자 영역으로 각기 다른 전공의 교수자들이 각기 다른 주제별 콘텐츠를 운영함으로써 학습자는 주제에 따른 교수자를 만나게 된다. 즉 하나의 교양강좌에서 다양한 전문가를 만날 수 있도록 하여 온라인강좌의 지루함을 최소화하고 수업에 흥미를 유발하도록 하였다. 셋째, 학습자-학습자 영역에서는 온라인 토론과 동료평가뿐 아니라 온라인 강좌를 수강 후 팀별 오프라인 활동을 수행하도록 함으로써 지식을 종합하고 전이할 수 있도록 구성하였다.",C-mooc; 상호작용 요소; K-MOOC; 문화예술; 인성교육,윤정진,교육과 문화,미래교육·창의연구소,2,2,93,104,2020,교육학,3,ART002910033
